id	bloque	titulo	cuerpo	enlace
10.3	PLAN DE EMERGENCIA EN POLÍTICA EXTERIOR Y DERECHOS HUMANOS	Comercio sí, pero para el 99%: no al TTIP	"El Tratado Transatlántico de Comercio e Inversión (TTIP, por sus siglas en inglés) 
es una amenaza a nuestra soberanía, a nuestra democracia, a nuestra economía y 
al Estado de bienestar porque concibe las regulaciones sociales y medioambientales como obstáculos
al comercio. En consecuencia:

-  Nos oponemos a la ratificación de los tratados comerciales TTIP, 
TISA (Acuerdo en Comercio de Servicios) y CETA
(Acuerdo Integral de Economía y Comercio) y estableceremos
un diálogo con otros Gobiernos europeos para que actúen de
la misma manera.
-  Auditaremos y pondremos fin a todos los Acuerdos de
Promoción y Protección Recíproca de Inversiones (APPRI)
que contengan mecanismos secretos de arbitraje privado entre inversores y Estados.
-  Promoveremos la creación de una red internacional de gobiernos e 
instituciones multilaterales ―como la Conferencia de
las Naciones Unidas sobre Comercio y Desarrollo (UNCTAD) y
la OIT―, un cambio en las políticas de comercio e inversión del
Consejo Europeo y una actitud disuasoria para que los países
de la Unión Europea no presionen a terceros para firmar nuevos tratados de comercio e inversión.
-  Elaboraremos un estudio de impacto integral, con participación de la 
sociedad civil, de la política comercial común de la
Unión Europea en España y en el mundo."	http://lasonrisadeunpais.es/fb-share/rescate/es/10.3.html
10.4	PLAN DE EMERGENCIA EN POLÍTICA EXTERIOR Y DERECHOS HUMANOS	Eliminación del secreto bancario privilegiado de los paraísos fiscales	"Exigiremos en los acuerdos internacionales la eliminación del secreto bancario 
privilegiado de los paraísos fiscales, para favorecer
la desaparición de la extraterritorialidad y la deslocalización del capital financiero."	http://lasonrisadeunpais.es/fb-share/rescate/es/10.4.html
10.5	PLAN DE EMERGENCIA EN POLÍTICA EXTERIOR Y DERECHOS HUMANOS	Plan de retorno de emigrantes españoles	"Pondremos en marcha una serie de mecanismos y organismos que
posibiliten el retorno de los emigrantes españoles a partir de un estudio sobre 
la realidad de la emigración española que nos permita conocer sus causas y 
características sociológicas. De este modo
podremos llevar a cabo políticas de retorno que se adecúen a este
fenómeno plural.

Para ello, será necesaria la implicación de las administraciones
locales y de la Oficina de la Emigración, como medios de intercambio 
de información y asistencia para facilitar el proceso de retorno.

Además, se deberá reconocer el acceso a la contratación pública de
la experiencia laboral en el extranjero, así como de los estudios y los
títulos de idiomas emitidos por instituciones oficiales extranjeras.
Asimismo, mejoraremos el sistema de contribuciones para el reconocimiento 
de los años cotizados en países de la Unión Europea,
y equipararemos los derechos de las personas emigradas a los del
resto de españoles en todo lo relativo a servicios sociales (por ejemplo, una vivienda de protección oficial)."	http://lasonrisadeunpais.es/fb-share/rescate/es/10.5.html
10.6	PLAN DE EMERGENCIA EN POLÍTICA EXTERIOR Y DERECHOS HUMANOS	Reconocimiento del Estado palestino	"Reconoceremos a Palestina como Estado de forma inminente y unilateral. 
Creemos que este primer paso es imprescindible, aunque no
el único, para garantizar la paz, el respeto a los derechos humanos
y la seguridad (doctrina de la seguridad humana de la ONU) entre
Israel y Palestina, así como el reconocimiento y disfrute de los derechos nacionales.

Se tratará de un compromiso histórico de nuestro Gobierno no
solo con los palestinos, sino también con la población de nuestro
país. Un compromiso histórico que deberá materializarse en hechos
concretos como primer paso para abordar otros asuntos, por lo que
propondremos que el Consejo de Seguridad de la ONU establezca
un plazo vinculante para que se retomen las negociaciones entre
israelíes y palestinos bajo la supervisión y el control de organismos
multilaterales internacionales.

En el caso de que se produzcan violaciones de derechos humanos, nuestro país 
impulsará la imposición de sanciones frente a las
políticas de ocupación, segregación, discriminación y castigos colectivos 
por parte del Estado de Israel hacia las poblaciones palestinas."	http://lasonrisadeunpais.es/fb-share/rescate/es/10.6.html
11.1	PLAN DE RESCATE DEMOCRÁTICO Y LIBERTADES CIVILES	Modificación del procedimiento de presentación de la Iniciativas Legislativas Populares	"La Junta Electoral Central deberá establecer un procedimiento telemático de 
apoyo a las iniciativas legislativas que facilite la participación."	http://lasonrisadeunpais.es/fb-share/rescate/es/11.1.html
11.2	PLAN DE RESCATE DEMOCRÁTICO Y LIBERTADES CIVILES	Derogación de la ley mordaza	"Derogaremos de manera inmediata la Ley Orgánica 4/2015, de 30 de
marzo, de protección de la seguridad ciudadana, conocida como ley
mordaza, y estableceremos una nueva legislación de seguridad ciudadana 
que facilite el libre ejercicio de los derechos fundamentales
de expresión, reunión y manifestación. Eliminaremos las sanciones
administrativas, sin más restricción que los actos ilícitos cuya gravedad 
los convierta en objeto de sanción en los supuestos sancionados por el Código Penal."	http://lasonrisadeunpais.es/fb-share/rescate/es/11.2.html
11.3	PLAN DE RESCATE DEMOCRÁTICO Y LIBERTADES CIVILES	Eliminación de privilegios de los cargos electos	"Acabaremos con los privilegios de los cargos electos (diputadas,
diputados, senadoras y senadores), tanto de aquellos de los que
gozan durante el ejercicio de sus funciones como de los que les son
atribuidos una vez que han concluido sus respectivos mandatos:

-  Rebajaremos las retribuciones de los miembros electos de
las Cortes, de manera que en ningún caso sea superior a la
de los cuerpos de funcionarios del Estado.
-  Revisaremos los complementos económicos: gastos de representación, libre disposición, indemnizaciones, etcétera.
-  Estableceremos mecanismos de control de las dietas y desplazamientos imprescindibles.
-  Eliminaremos las indemnizaciones por cese, derogaremos
las llamadas «pensiones de oro» de los exparlamentarios,
y equipararemos sus derechos y deberes laborales a los del
resto de las personas trabajadoras."	http://lasonrisadeunpais.es/fb-share/rescate/es/11.3.html
11.4	PLAN DE RESCATE DEMOCRÁTICO Y LIBERTADES CIVILES	Reforma de la Ley General de la Comunicación Audiovisual	"Para actualizar el espacio mediático español a los estándares europeos, 
llevaremos a cabo una reforma de la Ley General de la
Comunicación Audiovisual (LGCA) centrada en cuatro aspectos:

-  Desgubernamentalizar los medios públicos (RTVE, Agencia
EFE, etcétera), y así garantizar su independencia y pluralismo, 
la calidad de sus contenidos y el cumplimiento del derecho de acceso. 
Para ello, fomentaremos las competencias y
la participación de los Consejos de Informativos, un Consejo
Social, el Defensor del Espectador y las áreas de medios interactivos. 
Su presidencia será elegida a través de concurso
público que requerirá la presentación de un proyecto.
-  Llevar a cabo una revisión de los criterios de gestión del espectro 
radioeléctrico para garantizar un reparto más equilibrado
entre los tres sectores de la comunicación (público, comercial
y tercer sector), y conseguir un mejor aprovechamiento de este
espectro (de acuerdo con los estándares europeos) que garantice 
el derecho a la libre competencia y permita mejorar los
indicadores del pluralismo.
-  Reconocer y proteger los medios sociales y comunitarios sin
ánimo de lucro (siguiendo las recomendaciones de la Unesco).
Esto se complementará con la creación de dos Open Channels
de televisión digital terrestre (TDT) y radio con desconexiones 
locales, gestionados en colaboración con dichos medios
como ocurre en Alemania, Noruega o Finlandia.
-  Crear un Consejo del Audiovisual, independiente e integrado en
la Plataforma Europea de Autoridades Reguladoras (EPRA), similar 
a los que existen en algunos países de nuestro entorno."	http://lasonrisadeunpais.es/fb-share/rescate/es/11.4.html
11.5	PLAN DE RESCATE DEMOCRÁTICO Y LIBERTADES CIVILES	Apuesta por las cláusulas sociales y la contratación pública como instrumentos de generación de valor social	"Potenciaremos la aplicación efectiva de cláusulas sociales para el
acceso a los concursos públicos basados en compromisos de creación de empleo, 
desarrollo local, cohesión social y responsabilidad
social corporativa (RSC). Eliminaremos las trabas y condiciones
discriminatorias que puedan impedir o perjudicar la competitividad
de algunas de estas empresas en su acceso a los sistemas de contratación pública, 
a la vez que favoreceremos los sistemas de autorización o licencia 
no sometidos a la normativa de contratación
pública y permitidos en las directivas europeas, para la provisión de
la gestión de servicios sociales públicos o a cargo de entidades sin
ánimo de lucro."	http://lasonrisadeunpais.es/fb-share/rescate/es/11.5.html
12.1	PLAN CONTRA LA CORRUPCIÓN Y PARA LA TRANSPARENCIA INSTITUCIONAL	Plan Nacional contra la Corrupción y para la Transparencia Institucional	"Desarrollaremos un Plan Nacional contra la Corrupción y para la
Transparencia Institucional, que se coordinará a través de un organismo independiente del poder gubernamental.
Dicho organismo estará integrado por la Administración, organizaciones 
no gubernamentales (ONG) y actores relevantes de
la sociedad civil; y su ámbito de actuación abarcará las diferentes
administraciones territoriales del Estado. Sus principales objetivos
serán los siguientes:

-  Promover una mayor implicación de la sociedad civil, así
como de expertos, en el compromiso contra la corrupción.
-  Implementar y perfeccionar mecanismos preventivos que se
adapten a la dinámica realidad delictiva.
-  Dotar de recursos y adaptar las técnicas adecuadas para lograr una persecución eficaz y sostenible.
-  Asegurar una constante formación de los agentes especializados y una mayor coordinación entre ellos.
-  Facilitar la formación entre los funcionarios para la detección
y denuncia de este tipo de conductas.
-  Dotar de mecanismos reales de protección a los denunciantes
de hechos delictivos."	http://lasonrisadeunpais.es/fb-share/rescate/es/12.1.html
12.2	PLAN CONTRA LA CORRUPCIÓN Y PARA LA TRANSPARENCIA INSTITUCIONAL	Contratos administrativos abiertos y accesibles	"Aseguraremos la apertura de toda la información relativa a los procesos 
de contratación pública para facilitar la transparencia y la
rendición de cuentas a través de las siguientes medidas:

-  Crearemos una base de datos de contrataciones y licitaciones.
Todas las empresas enviarán la documentación relacionada
con las contrataciones en formatos abiertos para facilitar su
publicación en la red.
-  Aseguraremos el acceso a la documentación de los contratos
suscritos como mínimo en los últimos cinco años. En ella se
indicará la siguiente información: objeto, importe de la licitación 
y de adjudicación, procedimiento utilizado para contratar,
identidad del adjudicatario, duración, número de licitadores,
criterios de adjudicación, cuadro comparativo de ofertas y sus
respectivas puntuaciones, acuerdos e informes técnicos del
proceso de contratación, modificaciones contractuales, prórrogas 
de los contratos, licitaciones anuladas, resoluciones
anticipadas, datos del registro público de contratos, datos del
registro oficial de licitadores y empresas clasificadas, y acuerdos 
y criterios interpretativos de los órganos consultivos de
Contratación."	http://lasonrisadeunpais.es/fb-share/rescate/es/12.2.html
