id	bloque	titulo	cuerpo	enlace
3.5	PLAN 25 DE EMERGENCIA CIUDADANA	Rescate energético	"Consideraremos el acceso a la energía como un servicio público, independientemente de que sea gestionada por instituciones públicas o privadas, y garantizaremos por ley el acceso a un suministro
mínimo:

1.  No se procederá al corte de suministro de electricidad o gas
cuando se trate de la vivienda habitual del suministrado y cuando el 
impago de la factura sea debido a motivos ajenos a su voluntad y, 
en particular, por pobreza sobrevenida.
2.  Se establecerá un mínimo vital de electricidad y gas mensual
por hogar. Una vez constatada una situación de pobreza, el
pago de ese suministro mínimo vital no podrá suponer más
del 10 % de los ingresos mensuales del hogar. Los servicios
sociales determinarán la cantidad exacta que cada hogar en
situación de pobreza ha de pagar por el suministro mínimo.
3.  El consumidor tendrá derecho a las mismas condiciones de
acceso al suministro durante el periodo de un año, un derecho que se 
podrá ampliar anualmente y de manera indefinida
mientras la situación de pobreza persista.
4.  Las compañías suministradoras no podrán repercutir la correspondiente 
caída de sus ingresos al resto de consumidores o exigírsela al Estado.
5.  Derogaremos el Real Decreto 900 / 2015, de 9 de octubre, sobre 
autoconsumo eléctrico y aprobaremos una normativa que
permita su desarrollo, con las siguientes características básicas:

La energía autoconsumida instantáneamente queda libre de cualquier tipo de imposición.

La energía vertida al sistema eléctrico será justamente retribuida
por parte de la empresa comercializadora (mediante la cancelación
de la cantidad de kilovatio hora consumida de la red o por medio de
un saldo económico)."	http://lasonrisadeunpais.es/fb-share/rescate/es/3.5.html
3.6	PLAN 25 DE EMERGENCIA CIUDADANA	El agua: un derecho humano	"Aplicaremos distintas medidas para la detección y erradicación de
la pobreza hídrica y reconoceremos el agua como un derecho humano. 
Al ser el agua un derecho, garantizaremos una dotación mínima
para cada ciudadana y ciudadano, de modo que se cubran sus necesidades básicas.

Revisaremos los proyectos de construcción de las grandes infraestructuras 
hidráulicas (presas y trasvases) y desarrollaremos
unos sistemas alternativos de abastecimiento para los momentos
de escasez. En las cuencas beneficiarias de esos trasvases, 
la gestión de la demanda agraria, urbana e industrial, y la optimización de
los recursos no convencionales (reutilización de aguas residuales y
desalación marina) constituyen piezas clave en esa transición hacia
horizontes más sostenibles.

Pondremos en marcha un ambicioso programa de inversiones
públicas con el fin de dotar a todas las poblaciones de sistemas de
tratamiento de aguas residuales, y de este modo cumpliremos las
obligaciones de la Directiva 91 / 271 de Aguas Residuales y evitaremos 
las sanciones de la Unión Europea derivadas de la dejación de
funciones de los gobiernos anteriores."	http://lasonrisadeunpais.es/fb-share/rescate/es/3.6.html
3.7	PLAN 25 DE EMERGENCIA CIUDADANA	Un centro de servicios sociales por cada veinte mil habitantes	"Garantizaremos la prestación de servicios sociales públicos de
proximidad para toda la ciudadanía. Cualquier ciudadano tendrá
acceso universal y gratuito a un centro de servicios sociales compuesto 
por un trabajador o una trabajadora social, un educador o
una educadora social y un psicólogo o una psicóloga. Promoveremos
la gestión municipal de los equipos de servicios sociales."	http://lasonrisadeunpais.es/fb-share/rescate/es/3.7.html
4.1	PLAN DE RESCATE A AUTÓNOMOS Y PYMES	Cuotas justas para autónomos	"Estableceremos cuotas a la Seguridad Social porcentuales y progresivas 
en función del rendimiento neto para los autónomos
que facturen por encima del salario mínimo y un alta gratuita
para aquellos que lo hagan por debajo del salario mínimo interprofesional.
Estudiaremos la equiparación de las prestaciones del
Régimen Especial de Trabajadores Autónomos (RETA) al Régimen
General de la Seguridad Social. Posibilitaremos el pago trimestral,
en lugar de mensual, de las cotizaciones y solo desde el inicio de
la actividad; e informatizaremos y simplificaremos los trámites.
Analizaremos, igualmente, la posibilidad de desarrollar un régimen de 
cotizaciones a tiempo parcial, de manera que se pueda estar empleado por 
cuenta propia a media jornada."	http://lasonrisadeunpais.es/fb-share/rescate/es/4.1.html
4.2	PLAN DE RESCATE A AUTÓNOMOS Y PYMES	Cero morosidad de las administraciones y grandes empresas con autónomos y pymes	"Interpondremos sanciones reales y efectivas a quienes incumplan
la Ley de Morosidad, que fija en treinta días el plazo máximo para
que las administraciones paguen a sus proveedores y, en el caso del
sector privado, un plazo máximo de sesenta días. En las licitaciones
públicas será necesario justificar el cumplimiento de estos pagos
con las empresas subcontratadas."	http://lasonrisadeunpais.es/fb-share/rescate/es/4.2.html
4.3	PLAN DE RESCATE A AUTÓNOMOS Y PYMES	Autónomo de responsabilidad limitada e inclusión de los autónomos y las pequeñas empresas en el proceso simplificado de reestructuración y cancelación de deudas	"Estudiaremos el desarrollo de la figura del autónomo de responsabilidad 
limitada, de modo que todos los autónomos respondan a las
posibles deudas únicamente con los bienes profesionales que ellos
decidan asociar a su actividad y no con todo su patrimonio (como
ocurre ahora).

Asimismo, se incluirá a los autónomos y las pequeñas empresas
en el procedimiento simplificado de reestructuración y cancelación
de deudas."	http://lasonrisadeunpais.es/fb-share/rescate/es/4.3.html
4.4	PLAN DE RESCATE A AUTÓNOMOS Y PYMES	Banco de proyectos y acompañamiento	"Crearemos un banco de proyectos gestionado por el Servicio Público
de Empleo Estatal (SEPE), que ponga en común proyectos de mecenazgo 
con proyectos de emprendimiento, favoreciendo las fórmulas de la 
economía social (cooperativas y sociedades laborales).

Asimismo, el SEPE ofrecerá un servicio de asesoramiento y 
acompañamiento en la elaboración de proyectos empresariales, así como
en el rescate a pymes en crisis."	http://lasonrisadeunpais.es/fb-share/rescate/es/4.4.html
4.5	PLAN DE RESCATE A AUTÓNOMOS Y PYMES	Promoción de la innovación de empresas y pymes	"Facilitaremos y promoveremos la innovación entre las empresas
españolas, en especial entre las pymes. Para ello, crearemos 
polos de conocimiento y desarrollo económico especializados en áreas
y ámbitos determinados y localizados en diferentes regiones del
Estado.

Estos polos promoverán y facilitarán la interacción de todos los
protagonistas de la cadena productiva, de manera similar a los 
modelos internacionales (Poles en Francia, Fraunhofer Institutes en
Alemania, Catapult en Reino Unido) y nacionales (MCC-Mondragón
Corporación Cooperativa o COVAP en Andalucía)."	http://lasonrisadeunpais.es/fb-share/rescate/es/4.5.html
4.6	PLAN DE RESCATE A AUTÓNOMOS Y PYMES	Inclusión de cláusulas sociales y medioambientales en las licitaciones públicas	"Incluiremos cláusulas sociales y medioambientales en las licitaciones públicas, 
algo que haremos extensibles a las subcontrataciones,
de manera que se prioricen empresas de la economía social, pequeñas empresas 
y autónomos que se comprometan con el empleo de
calidad y el impacto positivo en la comunidad."	http://lasonrisadeunpais.es/fb-share/rescate/es/4.6.html
5.1	PLAN DE ESTÍMULO A LA ACTIVIDAD ARTÍSTICA Y CULTURAL	IVA cultural reducido	"En el marco de un conjunto de medidas de una reforma de la fiscalidad de 
la cultura encaminado a dinamizar y estimular la creación, la
producción, la distribución y el acceso, disminuiremos al tipo reducido 
el impuesto sobre el valor añadido (IVA) de los servicios y productos culturales
actualmente sujetos al tipo normal. Esta reforma
implicará una modificación de la Ley 37 / 1992 del IVA y tendrá como
objeto su armonización con la normativa y jurisprudencia comunitaria."	http://lasonrisadeunpais.es/fb-share/rescate/es/5.1.html
5.2	PLAN DE ESTÍMULO A LA ACTIVIDAD ARTÍSTICA Y CULTURAL	Estatuto del Artista y del Profesional de la Cultura	"Como medida de estímulo a la actividad y para acabar con la precariedad, 
desarrollaremos e implementaremos un Estatuto del Artista
y del Profesional de la Cultura, adaptado a las características de 
intermitencia del sector cultural y que comprenda tanto la actividad
desarrollada por aquellos que realizan su trabajo por cuenta ajena o
por cuenta propia. Dicho estatuto contemplará la especificidad de
los ingresos de corte irregular de los profesionales de la cultura y
creará una fiscalidad que se adapte a sus necesidades y que desemboque 
en una tributación justa tanto para la Hacienda Pública como
para los interesados.

Entre otras medidas fiscales, vincularemos para todo tipo de autónomos 
la liquidación de los impuestos trimestrales con la fecha de
pago del servicio prestado y no con la emisión de la correspondiente factura. 
En el caso de los trabajadores intermitentes, cuyas rentas
sean elevadas pero irregulares en el tiempo, se establecerá un criterio
de prorrateo a efectos de la aplicación del tipo fiscal correspondiente, con el 
objetivo de garantizar sobre estas rentas la progresividad
contemplada en la Ley del Impuesto sobre la Renta de las Personas
Físicas (LIRPF). Asimismo, se modificará el grupo específico de epígrafes 
en el impuesto sobre actividades económicas (IAE) para adaptarlo a las nuevas 
necesidades de los profesionales culturales por
cuenta propia, con la idea de unificar el sector y vincular las medidas
expuestas a sus características concretas.

En el terreno de la Seguridad Social, incluiremos un régimen específico de 
intermitentes culturales, enmarcado tanto en el Régimen
General (para trabajadores por cuenta ajena) como en el de Autónomos
(para trabajadores por cuenta propia), con el fin de contemplar todas
las posibles situaciones profesionales donde los artistas y los trabajadores 
de la cultura pueden encontrarse. Fomentaremos la contratación laboral y 
eliminaremos el sistema de falsos autónomos incorporando el sistema de 
intermitencia en el régimen general cuando las
características específicas de la prestación del servicio así lo determinen. 
En el caso de los trabajadores autónomos, modificaremos el sistema para que 
desarrollen su profesión sin necesidad de altas y bajas
constantes, se reconozca en materia de prestaciones las especificidades 
del empleo intermitente y se garantice un pago de cuotas acorde y
proporcional a los ingresos que hayan percibido. Dentro del régimen
de la Seguridad Social se contemplarán las enfermedades y lesiones
provenientes del desempeño de la labor artística y técnica para crear
un régimen de baja laboral que respete la especificidad de la situación
de estos trabajadores. Con respecto a los trabajadores de la cultura intermitentes, 
recogeremos en el Estatuto la jurisprudencia establecida por las Sentencias 
del Tribunal Supremo de 29/10/97 y 23/09/02,
según las cuales no se requiere el alta en la Seguridad Social, siempre
y cuando la actividad profesional desarrollada no sea la habitual y el
régimen de ingresos derivado se encuentre por debajo del Indicador
Público de Renta de Efectos Múltiples (IPREM). Igualmente, modificaremos 
el régimen de pluriempleo en la Seguridad Social para garantizar una mayor 
reducción de las cuotas en la compensación.

El Estatuto del Artista y del Profesional de la Cultura contemplará 
efectuar modificaciones en el Estatuto de los Trabajadores y la
Ley Orgánica de Libertad Sindical, con el fin de garantizar el efectivo
derecho de los trabajadores intermitentes a estar debidamente representados 
por sindicatos territorial y profesionalmente.

En el marco de este Estatuto y para fomentar la actividad artística sin ánimo de lucro, 
se modificará la Ley de Cooperativas con el
propósito de permitir la creación de cooperativas de trabajo asociado a 
los trabajadores intermitentes, y vincular estos sectores a los
hábitos y formas de la economía social y solidaria."	http://lasonrisadeunpais.es/fb-share/rescate/es/5.2.html
6.1	FAMILIA	Plan de choque por la dignidad de las personas en situación de dependencia y sus familias	"-  Derogar el Real Decreto 20 / 2012 que ha recortado los derechos efectivos y la 
financiación de la Administración General
del Estado a las comunidades autónomas.
-  Reponer el nivel acordado y el 13 % del nivel mínimo de financiación. Para ello, 
la financiación de la Ley de Dependencia
se basará en el coste real de los servicios prestados o de las
prestaciones concedidas y se dividirá en un 50 % a cargo de
la Administración General del Estado y en el 50 % restante a
cargo de las comunidades autónomas con la eliminación del
copago. Una vez implantado el sistema en todos los grados
y niveles, se articulará la financiación de la ley a través de la
Ley Orgánica de Financiación de las Comunidades Autónomas
(LOFCA).
-  Eliminar el «limbo de la dependencia» que afecta a más de
433 000 personas y exigir el cumplimiento de los seis meses
en el procedimiento completo de la ley, para que a todo el que
se le haya reconocido un grado y un nivel que conlleven el derecho a recibir 
las prestaciones y los servicios del sistema se le apruebe el 
Programa Individual de Atención (PIA) y pueda
recibirlos de manera efectiva.
-  Garantizar en los PIA una asistencia personal suficiente y
unos derechos para todos los adultos con planes de vida independiente y en todas las comunidades autónomas."	http://lasonrisadeunpais.es/fb-share/rescate/es/6.1.html
6.2	FAMILIA	Familias monomarentales: por una maternidad independiente y segura	"Pondremos en marcha medidas que garanticen la protección de las
familias de madres solteras con hijos o hijas a su cargo.
Incrementaremos para los beneficiarios actuales el importe de
la prestación de la Seguridad Social por hijo o hija a cargo, hasta 150
euros mensuales, en el caso de las familias monoparentales.

Crearemos una prestación de maternidad no contributiva para
las madres sin recursos que se encuentren en activo con demanda
de empleo.

Garantizaremos la protección de los niños y las niñas frente a los
desahucios y desalojos.

Consideraremos la unidad familiar monoparental a partir de un
hijo como una circunstancia familiar de especial vulnerabilidad.

Por ello, incrementaremos su protección frente a los desahucios;
les facilitaremos la posibilidad de que puedan reestructurar su 
deuda hipotecaria prioritariamente, y ampliaremos la protección de los
niños vulnerables en términos de realojo, para asegurarles una 
alternativa habitacional digna antes de proceder al desalojo."	http://lasonrisadeunpais.es/fb-share/rescate/es/6.2.html
6.3	FAMILIA	Permisos de paternidad y maternidad iguales, obligatorios e intransferibles	"Caminaremos hacia la igualdad de género en el mercado de trabajo
con la reforma del sistema de permisos por nacimiento o adopción,
y con el establecimiento de un calendario que aumente el actual
permiso de paternidad hasta igualarlo con el de maternidad. Para
garantizar la igualdad efectiva de derechos, el permiso debe ser:

-  Igual para cada persona progenitora e intransferible, como
todos los demás derechos laborales y sociales.
-  Pagado al 100 % del salario.
-  Con igual protección del puesto de trabajo durante el ejercicio
de los derechos de maternidad y paternidad.

Incrementaremos, además, las atribuciones de la inspección de 
trabajo y la Seguridad Social en materia de prohibición de las 
discriminaciones en la contratación, en la promoción y en la retribución.
Estableceremos una comisión estatal de seguimiento y control de
los planes de igualdad en las empresas, con capacidad de propuesta
para eliminar las discriminaciones, así como una comisión estatal
de seguimiento de la lucha contra el acoso laboral.

Abordaremos, asimismo, el objetivo específico de la eliminación
de la brecha salarial de género, que actualmente alcanza el 19 % en
nuestro país."	http://lasonrisadeunpais.es/fb-share/rescate/es/6.3.html
6.4	FAMILIA	Pacto de Estado por la infancia	"Desarrollaremos un Pacto de Estado por la Infancia que blinde los
derechos de la infancia y la adolescencia para garantizar la igualdad
de oportunidades entre niñas, niños y adolescentes (dada su condición 
de vulnerabilidad) y reducir la pobreza infantil. Este pacto
comportará, entre otras, la medida siguiente:

Desarrollo de planes específicos de formación y activación del
empleo destinados a fomentar la empleabilidad de los adultos con
niños, niñas o personas dependientes a su cargo, especialmente en
los casos de mujeres con niños a su cargo o adultos de familias monoparentales."	http://lasonrisadeunpais.es/fb-share/rescate/es/6.4.html
7.1	RESCATE EN IGUALDAD	Proteger el derecho a decidir de todas las mujeres	"Derogaremos la reforma de la Ley de Interrupción Voluntaria del
Embarazo para permitir que las menores de edad que sufren abusos y
se encuentran en una situación de vulnerabilidad en sus entornos 
familiares puedan interrumpir su embarazo sin el consentimiento paterno."	http://lasonrisadeunpais.es/fb-share/rescate/es/7.1.html
7.2	RESCATE EN IGUALDAD	Garantía habitacional para las víctimas de violencia machista	"Garantizaremos una alternativa habitacional inmediata, en un plazo 
de treinta días, para las mujeres y los menores que sean víctimas de la 
violencia machista. Asimismo, estableceremos su acceso
prioritario a las prestaciones (adecuadas y suficientes), incluidas en
el Procedimiento de Emergencia Ciudadana sin necesidad de una
denuncia previa y tras un informe de los profesionales cualificados
que están capacitados para atender a las mujeres víctimas de la violencia machista."	http://lasonrisadeunpais.es/fb-share/rescate/es/7.2.html
7.3	RESCATE EN IGUALDAD	Ratificación urgente del Convenio 189 de la Organización Internacional del Trabajo	"Adoptaremos medidas para asegurar la promoción y la protección
efectivas de los derechos humanos de todos los trabajadores y trabajadoras 
domésticos siguiendo las disposiciones del Convenio 189
de la Organización Internacional del Trabajo (OIT)."	http://lasonrisadeunpais.es/fb-share/rescate/es/7.3.html
8.1	RESCATE EDUCATIVO	Derogación de la LOMCE y apertura del debate en la comunidad educativa para una nueva ley	"Derogaremos la Ley Orgánica para la Mejora de la Calidad Educativa
(LOMCE) y promoveremos un amplio debate en la comunidad educativa para 
formular una nueva Ley de Educación que cuente con la mayor
participación y el mayor respaldo posible de la comunidad educativa.

Nuestros objetivos serán:
-  Poner fin a la inestabilidad del sistema educativo español
que, en los últimos treinta y tres años, ha elaborado siete leyes distintas sin contar apenas con la participación de la comunidad educativa.
-  La nueva Ley de Educación buscará el desarrollo personal y
social de las personas a lo largo de toda la vida."	http://lasonrisadeunpais.es/fb-share/rescate/es/8.1.html
8.2	RESCATE EDUCATIVO	Garantizar la sustitución inmediata del profesorado	"Garantizaremos la sustitución inmediata del profesorado con licencia 
por enfermedad, así como del profesorado con licencia por matrimonio o 
pareja de hecho o que soliciten licencias no retribuidas."	http://lasonrisadeunpais.es/fb-share/rescate/es/8.2.html
8.3	RESCATE EDUCATIVO	Plan contra el fracaso escolar	"Promoveremos la implementación de un programa contra el fracaso
escolar y de apoyo en entornos sociales desfavorecidos destinado a
paliar las desigualdades existentes en los distintos centros escolares.

Durante los 100 primeros días de Gobierno iniciaremos una primera fase de 
diagnóstico y evaluación de necesidades en colaboración
con los gobiernos autonómicos, con la finalidad de dotar de servicios y 
recursos de atención social y educativa a los centros de entornos sociales 
desfavorecidos. Igualmente, se analizará la situación de
emergencia en cada caso, en una escala de 1 a 5, para proceder a una
dotación extraordinaria de recursos: profesorado de apoyo, personal
especializado, reducción de la ratio, dotación adicional en nuevas
tecnologías, material escolar para el alumnado, actividades extraescolares 
de refuerzo educativo y programa de apertura de centros."	http://lasonrisadeunpais.es/fb-share/rescate/es/8.3.html
9.1	RESCATE DE LA SALUD	Salud universal	"Cobertura sanitaria universal: derecho a la tarjeta sanitaria para
todas las personas, también para los inmigrantes o emigrantes de
nacionalidad española, quienes pierden el acceso a la cobertura 
sanitaria universal noventa días después de su salida del país.

Derogación del Real Decreto 16 / 2012, de 20 de abril, de medidas
urgentes para garantizar la sostenibilidad del Sistema Nacional de
Salud y mejorar la calidad y seguridad de sus prestaciones, mediante 
el cual se destruyó la universalidad de la asistencia sanitaria en
España."	http://lasonrisadeunpais.es/fb-share/rescate/es/9.1.html
9.2	RESCATE DE LA SALUD	Plan de lucha contra el VIH: información, prevención y atención	"1.  Potenciaremos los programas de ITS / VIH abordando las desigualdades de género.
2.  Facilitaremos el acceso a la prueba rápida del VIH en los entornos no clínicos y apoyaremos a las entidades sociales que
realizan cribados, además de instaurarlos en los centros de
salud.
3.  Incluiremos en los centros educativos programas educativos
integrales sobre el VIH con perspectiva de género.
4.  Garantizaremos el acceso universal de todas las personas a
las carteras de servicios asistenciales de la sanidad pública,
independientemente de su condición laboral o situación administrativa.
5.  Garantizaremos la continuidad de las viviendas de apoyo al tratamiento y 
las viviendas de apoyo a los enfermos de sida como
herramientas indispensables en el tratamiento integral de las
personas con VIH que se encuentran en situación de emergencia
social, así como el refuerzo de los programas de apoyo psicosocial.
6.  Unificaremos los protocolos entre hospitales para evitar la
disparidad de criterios.
7.  Homogeneizaremos y mejoraremos la calidad de la asistencia
en los centros de ITS desde una perspectiva de género.
8.  Impulsaremos medidas que garanticen el tratamiento a las
personas con VIH privadas de libertad."	http://lasonrisadeunpais.es/fb-share/rescate/es/9.2.html
9.3	RESCATE DE LA SALUD	Ley para la Libre Disposición de la Propia Vida	"Aprobaremos una ley que posibilite la libre disposición de la propia vida y 
que regule el marco de la toma de decisiones al respecto.
Igualmente, derogaremos el apartado 4 del artículo 143 del Código
Penal.

Promoveremos un debate entre la ciudadanía y los profesionales de la salud 
sobre el grado de autonomía de las personas en
la toma de decisiones relativa a los últimos momentos de la vida,
acerca del testamento vital y de la muerte digna."	http://lasonrisadeunpais.es/fb-share/rescate/es/9.3.html
10.1	PLAN DE EMERGENCIA EN POLÍTICA EXTERIOR Y DERECHOS HUMANOS	Garantía del derecho de asilo	"-  Promoveremos la adopción de un sistema común de asilo real
y eficaz en el ámbito europeo que ponga fin a la falta de homogeneidad 
en la protección internacional de los refugiados
en los distintos países miembros, así como la creación de una
Agencia Europea de Salvamento.
-  Articularemos canales de entrada seguros y legales al recuperar la 
posibilidad de solicitar asilo diplomático en embajadas
y consulados españoles de terceros países y con la concesión
de visados humanitarios, la eliminación del visado de tránsito para 
quienes huyen de países en conflicto y la agilización
de los procesos de reunificación familiar. Además, crearemos
programas de reasentamiento dignos que aseguren una solución duradera 
y un compromiso de España en función de su
población y de sus recursos.
-  Aprobaremos, de manera urgente, el reglamento de la Ley
de Asilo, y revisaremos el sistema de examen y admisión a
trámite de las solicitudes de asilo, especialmente en aquellas
presentadas por motivos de orientación sexual o identidad
de género, trata o cualquier otro motivo relacionado con el
género (violencia, matrimonios forzados, mutilación genital,
Etcétera)."	http://lasonrisadeunpais.es/fb-share/rescate/es/10.1.html
10.2	PLAN DE EMERGENCIA EN POLÍTICA EXTERIOR Y DERECHOS HUMANOS	Creación de un «Eurogrupo Social»	"Crearemos un «Eurogrupo Social», que estará compuesto por los ministros de 
Empleo y Asuntos Sociales y supervisará los desequilibrios
sociales y la coordinación de las políticas laborales de la zona euro."	http://lasonrisadeunpais.es/fb-share/rescate/es/10.2.html
